{
  "schema_version": "1.0",
  "timestamp_utc": "2026-08-05T04:04:33Z",
  "sample_sha256": "000d6230792fefff601c0e5e87369196fdd5cfb484fdd87916a080d8b9ffc1c6",
  "input_path": "H:\\Dataset\\files\\malware\\000d6230792fefff601c0e5e87369196fdd5cfb484fdd87916a080d8b9ffc1c6",
  "report_dir": "C:\\Users\\ADMIN\\HyperAgent\\reports\\000d6230792fefff601c0e5e87369196fdd5cfb484fdd87916a080d8b9ffc1c6",
  "current_stage_id": "08-report",
  "last_error": null,
  "stages": {
    "01-prepare-env": {
      "skill": "hyperagent-prepare-env",
      "status": "completed",
      "output_path": "C:\\Users\\ADMIN\\HyperAgent\\reports\\000d6230792fefff601c0e5e87369196fdd5cfb484fdd87916a080d8b9ffc1c6\\01-prepare-env.json",
      "progress_path": null,
      "updated_at": "2026-08-04T02:58:45Z"
    },
    "02-static-pass1": {
      "skill": "hyperagent-static",
      "status": "completed",
      "output_path": "C:\\Users\\ADMIN\\HyperAgent\\reports\\000d6230792fefff601c0e5e87369196fdd5cfb484fdd87916a080d8b9ffc1c6\\02-static-pass1.json",
      "progress_path": null,
      "updated_at": "2026-08-04T03:59:40Z"
    },
    "03-unpack": {
      "skill": "hyperagent-unpack",
      "status": "completed",
      "output_path": "C:\\Users\\ADMIN\\HyperAgent\\reports\\000d6230792fefff601c0e5e87369196fdd5cfb484fdd87916a080d8b9ffc1c6\\03-unpack.json",
      "progress_path": null,
      "updated_at": "2026-08-04T04:25:44Z"
    },
    "04-static-pass2": {
      "skill": "hyperagent-static",
      "status": "completed",
      "output_path": "C:\\Users\\ADMIN\\HyperAgent\\reports\\000d6230792fefff601c0e5e87369196fdd5cfb484fdd87916a080d8b9ffc1c6\\04-static-pass2.json",
      "progress_path": null,
      "updated_at": "2026-08-04T05:30:21Z"
    },
    "05-dynamic": {
      "skill": "hyperagent-dynamic",
      "status": "completed",
      "output_path": "C:\\Users\\ADMIN\\HyperAgent\\reports\\000d6230792fefff601c0e5e87369196fdd5cfb484fdd87916a080d8b9ffc1c6\\05-dynamic.json",
      "progress_path": "C:\\Users\\ADMIN\\HyperAgent\\reports\\000d6230792fefff601c0e5e87369196fdd5cfb484fdd87916a080d8b9ffc1c6\\_state\\05-dynamic.progress.md",
      "updated_at": "2026-08-04T15:27:41Z"
    },
    "06-intel": {
      "skill": "hyperagent-intel",
      "status": "completed",
      "output_path": "C:\\Users\\ADMIN\\HyperAgent\\reports\\000d6230792fefff601c0e5e87369196fdd5cfb484fdd87916a080d8b9ffc1c6\\06-intel.json",
      "progress_path": null,
      "updated_at": "2026-08-05T02:51:26Z"
    },
    "07-deepdive": {
      "skill": "hyperagent-deepdive",
      "status": "completed",
      "output_path": "C:\\Users\\ADMIN\\HyperAgent\\reports\\000d6230792fefff601c0e5e87369196fdd5cfb484fdd87916a080d8b9ffc1c6\\07-deepdive.json",
      "progress_path": null,
      "updated_at": "2026-08-05T03:33:38Z"
    },
    "08-report": {
      "skill": "hyperagent-report",
      "status": "completed",
      "output_path": "C:\\Users\\ADMIN\\HyperAgent\\reports\\000d6230792fefff601c0e5e87369196fdd5cfb484fdd87916a080d8b9ffc1c6\\reports\\000d6230792fefff601c0e5e87369196fdd5cfb484fdd87916a080d8b9ffc1c6\\08-report.md",
      "progress_path": "C:\\Users\\ADMIN\\HyperAgent\\reports\\000d6230792fefff601c0e5e87369196fdd5cfb484fdd87916a080d8b9ffc1c6\\reports\\000d6230792fefff601c0e5e87369196fdd5cfb484fdd87916a080d8b9ffc1c6\\_state\\08-report.progress.md",
      "updated_at": "2026-08-05T03:49:06Z"
    },
    "09-summary": {
      "skill": "hyperagent-summary",
      "status": "completed",
      "output_path": "C:\\Users\\ADMIN\\HyperAgent\\reports\\000d6230792fefff601c0e5e87369196fdd5cfb484fdd87916a080d8b9ffc1c6\\09-summary.json",
      "progress_path": null,
      "updated_at": "2026-08-05T04:04:33Z"
    }
  }
}
